<?xml version="1.0" encoding="UTF-8"?>

<atom-hopper-config xmlns="http://atomhopper.org/atom/hopper-config/v1.0" xmlns:xsi="http://www.w3.org/2001/XMLSchema-instance" xsi:schemaLocation="http://atomhopper.org/atom/hopper-config/v1.0 ./../../config/atom-hopper-config.xsd">
    <defaults>
        <author name="Atom Hopper" />
    </defaults>

    <host domain="domain.com" scheme="http" />

    <workspace title="Testing Namespce" resource="/test/">
        <defaults>
            <author name="Atom Hopper in Workspace" />
        </defaults>

        <categories-descriptor reference="workspace-categories-descriptor" />

        <feed title="Testing Feed" resource="/feed" archived="false">
            <feed-source reference="feed-source-adapter" />

            <publisher reference="net.jps.atom.adapter.InMemoryPublisher">
                <parameter name="net.jps.atom.adapter.db.show_sql" value="true" />
            </publisher>
        </feed>

        <feed title="Testing Feed Archive" resource="/archive/" archived="true">
            <feed-source reference="feed-archive-adapter" />
        </feed>
    </workspace>

    <workspace title="Testing Namespce Part Two" resource="/test_2/">
        <defaults>
            <author name="Atom Hopper in Workspace" />
        </defaults>

        <feed title="Testing Feed Archive Part Two" resource="/archive/feed" archived="true">
            <feed-source reference="feed-archive-adapter" />
        </feed>
    </workspace>
</atom-hopper-config>